N;SPECIES_MDR1;NAME;CAS;SMILES;PARSED_SMILES;SUBST_SCORE;SUBST_DATA;INHIB_SCORE;INHIB_SCORE_TYPE;INHIB_DATA;INHIB_REF;EXPERIMENT;COMMENT;REFERENCE;INDUCER_SCORE;TARGET;class
2654;Human;Mitoxantrone;65271809;O=C2c1c(c(NCCNCCO)ccc1NCCNCCO)C(=O)c3c2c(O)ccc3O;O=C1C3=C(C(C2=C1C(=CC=C2NCCNCCO)NCCNCCO)=O)C(=CC=C3O)O;1.0;Kact=7mkM ;0.0;10uM;"50% at 50mkM; IC50=61mkM";"Methotrexate; Estrone 3-sulfate";membrane vesicle from BCRP-expressing Sf9 cell;"ATP hydrolysis; substrate of both, mutant and wild-type forms";"C. Ozvegy, Biochem Biophys Res Commun (2001) 285, 111-7; E. L. Volk, Cancer Res (2003) 63, 5538-43; M. Suzuki, J Biol Chem (2003) 278, 22644-9; Y.Han et al, Eur J Pharm Sci (2008) 35, 30-41; P.Matsson et al, Pharm Res(2009), 26(8), 1816-31";;BCRP;1
2655;Human;MK-571;86840;O=C(N(C)C)CCSC(SCCC(=O)O)c1cccc(c1)\C=C\c2nc3cc(Cl)ccc3cc2;O=C(N(C)C)CCSC(SCCC(=O)O)C1=CC(=CC=C1)C(/[H])=C(/[H])C2=CC=C3C=CC(=CC3=N2)[Cl];0.2;(likely inactive);0.5;10uM;IC50=50mkM (30% at 50mkM);Mitoxantrone;Saos-2/wtABCG2 cells;ABCG2 (BCRP) Mitoxantrone accumulation;"W. Brand et al, Biomedicine & Pharmacotherapy 60 (2006) 508-519; P.Matsson et al, Pharm Res(2009), 26(8), 1816-31";;BCRP;0
2662;Human;NB-506;151069124;O=CNN1C(=O)c2c(C1=O)c3c4cccc(O)c4Nc3c5c2c6cccc(O)c6N5C7OC(CO)C(O)C(O)C7O;O=CNN1C(C2=C(C1=O)C5=C(C3NC4=C(C=CC=C4C2=3)O)N(C6=C(C=CC=C56)O)C7C(C(C(C(O7)CO)O)O)O)=O;1.0;+ ;;10uM;;;LY and LY/NR2 cell ;intracellular accumulation ;H. Komatani, Cancer Res (2001) 61, 2827-32 ;;BCRP;1
2666;Human;NH125 (2-methyl imidazolium iodide derivative);278603080;CCCCCCCCCCCCCCCC[N+]1=C(C)N(Cc2ccccc2)C=C1.[I-];CCCCCCCCCCCCCCCC[N+]1C=CN(C=1C)CC2=CC=CC=C2;0.05;(imputed as non-binder from inhibition data);0.0;10uM; - at 50mkM;Methotrexate;"A2780-Dx cell; MCF-7 cell ";increase in Methotrexate intracellular accumulation (MTX: 1mkm);S. Arora, Mol Pharmacol (2004) 66, 460-7 ;;BCRP;0
2673;Human;NSC-23925;19287559;COc1ccc(cc1)c2nc3ccccc3c(c2)C(O)C4CCCCN4;COC1=CC=C(C=C1)C2=CC(=C3C=CC=CC3=N2)C(O)C4NCCCC4;0.1; - [by inference];0.0;10uM; - at 10mkM;Calcein-AM;;drug resistance;Z.Duan et al, PLoS One (2009) 4(10), e7415;;BCRP;0
2674;Human;NX211;149882100;O=C1[C@](C2C=C3N(C(C=2CO1)=O)CC4C(=C5C=C6OCCOC6=CC5=NC3=4)CN7CCN(CC7)C)(O)CC;O=C1[C@](C2C=C3N(C(C=2CO1)=O)CC4C(=C5C=C6OCCOC6=CC5=NC3=4)CN7CCN(CC7)C)(O)CC;1.0; + (weaker than of irinotecan);;10uM;;;T8 and MX3 cell ;drug resistance;"M. Maliepaard, Clin Cancer Res (2001) 7, 935-41; PMID17346156";;BCRP;1
2677;Human;Ortataxel;186348232;O=C(OC(C)(C)C)N[C@@H](CC(C)C)[C@@H](O)C(=O)O[C@@H]2C(=C4/[C@@H](OC(=O)C)C(=O)[C@]6([C@H]([C@H](OC(=O)c1ccccc1)[C@@]3(OC(=O)O[C@@H]23)C4(C)C)[C@@]5(OC(=O)C)[C@H](OC5)C[C@@H]6O)C)/C;O=C(OC(C)(C)C)N[C@@H](CC(C)C)[C@@H](O)C(=O)O[C@H]2[C@@H]6OC(O[C@@]16[C@H]([C@H]3[C@@](C([C@@H](/C(C1(C)C)=C2/C)OC(=O)C)=O)([C@H](C[C@@H]4[C@@]3(CO4)OC(=O)C)O)C)OC(=O)C5=CC=CC=C5)=O;0.0; - [Brooks TA];1.0;10uM; + at 10mkM;Mitoxantrone;8226/MR20 cells;efflux of 3mkM mitoxantrone ;"PMID17346156; H. Minderman, Cancer Chemother Pharmacol (2004) 53, 363-9; Brooks TA et al, Anticancer Research (2004) 24, 409-416";;BCRP;0
2679;Human;Oxfendazole;53716500;O=S(c2cc1c(nc(n1)NC(=O)OC)cc2)c3ccccc3;O=S(C1=CC=C2C(=C1)N=C(N2)NC(=O)OC)C3=CC=CC=C3;1.0; + (moderate substrate);0.0;10uM;"70% at 100mkM (60% at 250mkM, 0% at 375mkM); 0% at 375mkM";"Mitoxantrone; PhIP";BCRP-expressing MDCKII cells ;transepithelial transport (10mkM), transport inhibition (PhIP 2mkM, Mitoxantrone 5mkM);G. Merino, Drug Metab Dispos (2005) , 33(5), 614-618;;BCRP;1
2680;Human;Paclitaxel;33069624;O=C(N[C@@H](c1ccccc1)[C@@H](O)C(=O)O[C@H]5C[C@@]6(O)[C@@H](OC(=O)c2ccccc2)[C@H]3[C@@](C)([C@@H](O)C[C@H]4OC[C@@]34OC(C)=O)C(=O)[C@H](OC(C)=O)\C(=C5/C)[C@]6(C)C)c7ccccc7;O=C(N[C@@H](C1=CC=CC=C1)[C@@H](O)C(=O)O[C@@H]2C(\C)=C3/[C@H](C([C@@]5([C@H]([C@@H]([C@@](C2)([C@]3(C)C)O)OC(=O)C4=CC=CC=C4)[C@]6(CO[C@@H]6C[C@@H]5O)OC(C)=O)C)=O)OC(C)=O)C7=CC=CC=C7;0.0;;0.2;10uM;(likely inactive);; ;"SYN: Taxol; (from review)";"P.Borst et al, J.Nat.Cancer Inst 92 (2000) 1295-1302; PMID17346156";;BCRP;0
2681;;Pantoprazole;102625707;FC(F)Oc3cc1c(nc(n1)S(=O)Cc2nccc(OC)c2OC)cc3;FC(F)OC1=CC=C2C(=C1)N=C(N2)S(=O)CC3=C(C(=CC=N3)OC)OC;1.0;Km=0.1-0.2mM ;1.0;10uM;IC50=13mkM;methotrexate;Bcrp-expressing MDCKII cell ;transepithelial transport ;P. Breedveld, Cancer Res (2004) 64, 5804-11 ;;BCRP;1
2684;Human;Pheophorbide alpha;6056888;O=C(O)CCC1C(C)C(N=C12)=CC3=C(C)C(C(C)O)=C(N3)C=C4C(C)=C(CC)C(=N4)C=C5C(C)=C6C(N5)=C2CC6=O;O=C(O)CCC1C6=NC(C1C)=CC2NC(=C(C=2C)C(C)O)C=C3N=C(C(=C3C)CC)C=C4NC5C(=C4C)C(CC=56)=O;1.0; + (def);;10uM;;;MDCKII-BCRP;transport inhibition;"PMID17346156; J.Weiss et al, J Antimicrob Chemother(2007), 59(2), 238-245";;BCRP;1
2687;Human;Phosphatidylserine;8002435;CCCCCC=CCC=CCCCCCCCC(OC(COC(CCCCCCCC=CCC=CCCCCCC)=O)COP(O)(OCCN(C)(C)C)=O)=O;CCCCCC=CCC=CCCCCCCCC(OC(COC(CCCCCCCC=CCC=CCCCCCC)=O)COP(O)(OCC[N+](C)(C)C)=O)=O;1.0;;;10uM;;;; (from review);PMID17346156;;BCRP;1
2688;;Phytoporphyrin;26359433;O=C(O)CCC=6c2nc(cc5c(c(c(cc1c(c(c(n1)cc\3nc4c2CC(=O)\C4=C/3C)CC)C)n5)CC)C)C=6C;O=C(O)CCC1=C(C2=NC1=C5C6=NC(=CC4=C(C(=C(C=C3C(=C(C(=C2)N3)C)CC)N4)C)CC)C(=C/6C(=O)C5)/C)C;1.0;;;10uM;;;; (from review);PMID17346156;;BCRP;1
2691;Human;Pitavastatin;147511691;O=C(O)C[C@H](O)C[C@H](O)/C=C/c1c(c3ccccc3nc1C2CC2)c4ccc(F)cc4;O=C(O)C[C@H](O)C[C@H](O)/C=C(\[H])C1C(=NC3=CC=CC=C3C=1C2=CC=C(C=C2)F)C4CC4;1.0;Km=5.73mkM;1.0;10uM;Ki=2.92mkM;Estrone-3-sulfate;HEK293/BCRP membrane vesicles, MDCKII/BCRP;uptake, transport inhibition (via ATPase activity);M.Hirano et al, Mol Pharm (2005) 68(3), 800-7;;BCRP;1
2693;Human;Pravastatin (acid);81093370;O=C(O)C[C@H](O)C[C@H](O)CC[C@H]2[C@H](/C=C\C1=C\[C@@H](O)C[C@H](OC(=O)[C@@H](C)CC)[C@@H]12)C;O=C(O)C[C@H](O)C[C@H](O)CC[C@@H]1[C@H]2[C@H](C[C@@H](\C=C/2C(/[H])=C/[C@@H]1C)O)OC(=O)[C@@H](C)CC;1.0;(+) ;0.0;10uM;"76% at 1000mkM; 0.8-fold increase at 50mkM (102% at 50mkM); Ki > 300mkM";"Estrone-3-sulfate; Mitoxantrone; Estrone-3-sulfate";"OATP1B1/BCRP double transfected MDCKII cell; Saos-2/wtABCG2 cells; HEK293/BCRP membrane vesicles";"Transepithelical Transport (basal to apical); ABCG2 (BCRP) Mitoxantrone accumulation (fold increase, at 50mkM)";"S. Matsushima, J Pharmacol Exp Ther (2005) 314, 1059-67; P.Matsson et al, Pharm Res(2009), 26(8), 1816-31; M. Suzuki, J Biol Chem (2003) 278, 22644-9; M.Hirano et al, Mol Pharm (2005) 68(3), 800-7";;BCRP;1
2694;Human;Prazosin;19216569;O=C(N3CCN(c2nc1cc(OC)c(OC)cc1c(n2)N)CC3)c4occc4;O=C(N1CCN(CC1)C2=NC(=C3C=C(C(=CC3=N2)OC)OC)N)C4=CC=CO4;1.0;Kact=1mkM ;0.5;10uM;5.7-fold increase at 50mkM (32% at 50mkM), IC50=36mkM;Mitoxantrone;"membrane vesicle from BCRP-expressing Sf9 cell; Saos-2/wtABCG2 cells";"ATP hydrolysis; Mitoxantrone (1mkM) accumulation (fold increase, at 50mkM)";"C. Ozvegy, Biochem Biophys Res Commun (2001) 285, 111-7; P.Matsson et al, J Pharmacol Exp Ther(2007), 323(1), 19-30; P.Matsson et al, Pharm Res(2009), 26(8), 1816-31";;BCRP;1
2698;Human;Progesterone;57830;O=C4\C=C2/[C@]([C@H]1CC[C@@]3([C@@H](C(=O)C)CC[C@H]3[C@@H]1CC2)C)(C)CC4;O=C4C(/[H])=C3/[C@@]([C@@H]1[C@H]([C@@H]2CC[C@@H]([C@@]2(CC1)C)C(=O)C)CC3)(C)CC4;1.0;;0.5;10uM;4.9-fold increase at 50mkM;Mitoxantrone;Saos-2/wtABCG2 cells;"ABCG2 (BCRP) Mitoxantrone accumulation (fold increase, at 50mkM); ATPase assay ";T. Janvilisri, J Biol Chem (2003) 278, 20645-51 ;;BCRP;1
2703;Human;Quercetin-4'-glucoside;20229565;O=C1C(O)=C(Oc2cc(O)cc(O)c12)c4ccc(O[C@@H]3O[C@@H]([C@@H](O)[C@H](O)[C@H]3O)CO)c(O)c4;O=C1C4=C(C=C(C=C4OC(=C1O)C2=CC(=C(C=C2)O[C@H]3[C@@H]([C@H]([C@@H]([C@H](O3)CO)O)O)O)O)O)O;0.2;(likely inactive);0.2;10uM;(likely inactive);;; (from review);W. Brand et al, Biomedicine & Pharmacotherapy 60 (2006) 508-519;;BCRP;0
2707;Human;Resveratrol;501360;Oc2cc(\C=C\c1ccc(O)cc1)cc(O)c2;OC1=CC(=CC(=C1)C(/[H])=C(/[H])C2=CC=C(C=C2)O)O;0.2;(likely inactive);0.0;10uM; - at 10mkM;SN-38;K562/BCRP;transport inhibition, drug resistance;"W. Brand et al, Biomedicine & Pharmacotherapy 60 (2006) 508-519; K.Katayama et al, Cancer Chemother Pharmacol (2007) 60, 789-797";;BCRP;0
2708;Human;Rhodamine 123;62669709;COC(=O)C1=C(C=CC=C1)C2=C4C=CC(C=C4OC3=CC(=CC=C23)N)=N;COC(=O)C1=C(C=CC=C1)C2=C4C=CC(C=C4OC3=CC(=CC=C23)N)=N;1.0;Kact=4.5mkM ;;10uM;;;membrane vesicle from BCRP-expressing Sf9 cell ;"ATP hydrolysis; NB transported by mutant R482T protein only (e.g. MCF7 cells)!";"C. Ozvegy, Biochem Biophys Res Commun (2001) 285, 111-7; Y.Han et al, Eur J Pharm Sci (2008) 35, 30-41";;BCRP;1
2711;Human;Robinetin;490313;O=C1c3c(OC(=C1O)c2cc(O)c(O)c(O)c2)cc(O)cc3;O=C1C(=C(OC2=C1C=CC(=C2)O)C3=CC(=C(C(=C3)O)O)O)O;0.2;(likely inactive);0.2;10uM;(likely inactive);;; (from review);W. Brand et al, Biomedicine & Pharmacotherapy 60 (2006) 508-519;;BCRP;0
2712;Human;Rosuvastatin;287714414;O=S(=O)(N(C1=NC(=C(C(=N1)C2=CC=C(C=C2)F)C(/[H])=C\[C@@H](O)C[C@@H](O)CC(=O)O)C(C)C)C)C;O=S(=O)(N(C1=NC(=C(C(=N1)C(C)C)C(/[H])=C\[C@@H](O)C[C@@H](O)CC(=O)O)C2=CC=C(C=C2)F)C)C;1.0;" + ; Km=10.1mkM; Km=2mkM (high affinity) and Km=60.9mkM (low affinity) for two-site model";1.0;10uM;Ki=15.4mkM;Estrone-3-sulfate;"HEK293/BCRP membrane vesicles; MDCKII-BCRP; CRP-expressing HEK293 vesicles and MDCKII/BCRP";transport inhibition, uptake;"L.Zhang et al, Mol. Pharm (2006), 3(1) 62-69; M.Hirano et al, Mol Pharm (2005) 68(3), 800-7; J.W.Deng et al,Pharm Res(2008), 25(8), 1807-14; S.Kitamura et al, Drug Metab Dispos(2008), 36(10), 2014-23";;BCRP;1
2717;Human;Simvastatin (lactone);79902639;O=C(O[C@@H]1[C@H]3C(=C/[C@H](C)C1)\C=C/[C@@H]([C@@H]3CC[C@H]2OC(=O)C[C@H](O)C2)C)C(C)(C)CC;O=C(O[C@H]1C[C@H](/C=C2C(/[H])=C/[C@@H]([C@@H]([C@@H]1/2)CC[C@@H]3C[C@H](CC(O3)=O)O)C)C)C(C)(C)CC;1.0; +;0.5;10uM;"3.9-fold increase at 50mkM (36% at 50mkM); Ki=18mkM";"Mitoxantrone; Estrone-3-sulfate";"Saos-2/wtABCG2 cells; HEK293/BCRP membrane vesicles";ABCG2 (BCRP) Mitoxantrone accumulation (fold increase, at 50mkM);"P.Matsson et al, J Pharmacol Exp Ther(2007), 323(1), 19-30; M.Hirano et al, Mol Pharm (2005) 68(3), 800-7";;BCRP;1
2718;Human;SN-22;78287271;O=C\1N4\C(=C/C2=C/1COC(=O)[C@]2(O)CC)c3nc5c(c(c3C4)CC)cccc5;O=C1C5=C(C(\[H])=C2N1CC3C(=C4C(=NC/2=3)C=CC=C4)CC)/[C@](C(OC\5)=O)(O)CC;0.0;3.5-fold resistance;;10uM;;;BCRP-expressing PC-6 cell ;uptake ;M. Yoshikawa, Int J Cancer (2004) 110, 921-7 ;;BCRP;0
2719;Human;SN-343;124622737;O=C\1N4\C(=C/C2=C/1COC(=O)[C@]2(O)CC)c3nc5c(c(c3C4)CC)cc(C)cc5;O=C1C5=C(C(\[H])=C2N1CC3C(=C4C(=NC/2=3)C=CC(=C4)C)CC)/[C@](C(OC\5)=O)(O)CC;0.0;2.4-fold resistance;;10uM;;;BCRP-expressing PC-6 cell ;uptake ;M. Yoshikawa, Int J Cancer (2004) 110, 921-7 ;;BCRP;0
2720;Human;SN-348;124622726;O=C\1N4\C(=C/C2=C/1COC(=O)[C@]2(O)CC)c3nc5c(c(c3C4)CC)cc([Br])cc5;O=C1C5=C(C(\[H])=C2N1CC3C(=C4C(=NC/2=3)C=CC(=C4)[Br])CC)/[C@](C(OC\5)=O)(O)CC;0.0;2.9-fold resistance;;10uM;;;BCRP-expressing PC-6 cell ;uptake ;M. Yoshikawa, Int J Cancer (2004) 110, 921-7 ;;BCRP;0
2723;Human;SN-352;124622793;O=C\1N4\C(=C/C2=C/1COC(=O)[C@]2(O)CC)c3nc5c(c(c3C4)CC)ccc([Cl])c5;O=C1C5=C(C(\[H])=C2N1CC3C(=C4C(=NC/2=3)C=C(C=C4)[Cl])CC)/[C@](C(OC\5)=O)(O)CC;0.0;2.6-fold resistance;;10uM;;;BCRP-expressing PC-6 cell ;uptake ;M. Yoshikawa, Int J Cancer (2004) 110, 921-7 ;;BCRP;0
2724;Human;SN-353;124622782;O=C\1N4\C(=C/C2=C/1COC(=O)[C@]2(O)CC)c3nc5c(c(c3C4)CC)ccc(F)c5;O=C1C5=C(C(\[H])=C2N1CC3C(=C4C(=NC/2=3)C=C(C=C4)F)CC)/[C@](C(OC\5)=O)(O)CC;0.0;3.6-fold resistance;;10uM;;;BCRP-expressing PC-6 cell ;uptake ;M. Yoshikawa, Int J Cancer (2004) 110, 921-7 ;;BCRP;0
2725;Human;SN-355;124623047;O=C\1N4\C(=C/C2=C/1COC(=O)[C@]2(O)CC)c3nc5c(c(c3C4)CC)ccc(O)c5;O=C1C5=C(C(\[H])=C2N1CC3C(=C4C(=NC/2=3)C=C(C=C4)O)CC)/[C@](C(OC\5)=O)(O)CC;1.0;105-fold resistance;;10uM;;;BCRP-expressing PC-6 cell ;uptake ;M. Yoshikawa, Int J Cancer (2004) 110, 921-7 ;;BCRP;1
2726;Human;SN-364;124652693;O=C\1N4\C(=C/C2=C/1COC(=O)[C@]2(O)CC)c3nc5c(c(c3C4)CC)cc([Cl])c([Cl])c5;O=C1C5=C(C(\[H])=C2N1CC3C(=C4C(=NC/2=3)C=C(C(=C4)[Cl])[Cl])CC)/[C@](C(OC\5)=O)(O)CC;0.0;2.0-fold resistance;;10uM;;;BCRP-expressing PC-6 cell ;uptake ;M. Yoshikawa, Int J Cancer (2004) 110, 921-7 ;;BCRP;0
2727;Human;SN-38 (7-ethyl-10-hydroxycamptothecin);86639523;O=C1C5=C(C=C2N1CC3C(=C4C(=NC2=3)C=CC(=C4)O)CC)[C@@](C(OC5)=O)(O)CC;O=C1C5=C(C=C2N1CC3C(=C4C(=NC2=3)C=CC(=C4)O)CC)[C@@](C(OC5)=O)(O)CC;1.0;Km=4mkM ;1.0;10uM;IC50=1.6mkM (60% at 10mkM, 40% at 20mkM);Estrone 3-sulfate;"membrane vesicle from PC-6/SN2-5H; membrane vesicle from BCRP-expressing K562 cell";uptake ;"K. Nakatomi, Biochem Biophys Res Commun (2001) 288, 827-32; M. Suzuki, J Biol Chem (2003) 278, 22644-9; Y. Imai, Mol Pharmacol (2003) 64, 610-8";;BCRP;1
2728;Human;SN-38 glucuronide;121080635;O=C2OCC=1C(=O)N6/C(=C\C=1[C@@]2(O)CC)c5nc4c(cc(O[C@@H]3O[C@H](C(=O)O)[C@@H](O)[C@H](O)[C@H]3O)cc4)c(c5C6)CC;O=C1[C@@](C2C(\[H])=C3N(C(C=2CO1)=O)CC4C(=C5C(=NC/3=4)C=CC(=C5)O[C@H]6[C@@H]([C@H]([C@@H]([C@H](O6)C(=O)O)O)O)O)CC)(O)CC;1.0;Km=26mkM ;;10uM;;;membrane vesicle from PC-6/SN2-5H ;uptake ;K. Nakatomi, Biochem Biophys Res Commun (2001) 288, 827-32 ;;BCRP;1
2729;Human;SN-392;124622760;O=C\1N4\C(=C/C2=C/1COC(=O)[C@]2(O)CC)c3nc5c(c(c3C4)CC)cc(N)cc5;O=C1C5=C(C(\[H])=C2N1CC3C(=C4C(=NC/2=3)C=CC(=C4)N)CC)/[C@](C(OC\5)=O)(O)CC;1.0;55-fold resistance;;10uM;;;BCRP-expressing PC-6 cell ;uptake ;M. Yoshikawa, Int J Cancer (2004) 110, 921-7 ;;BCRP;1
2730;Human;SN-397;124622997;O=C\1N4\C(=C/C2=C/1COC(=O)[C@]2(O)CC)c3nc5c(c(c3C4)CC)cc(OC)c(F)c5;O=C1C5=C(C(\[H])=C2N1CC3C(=C4C(=NC/2=3)C=C(C(=C4)OC)F)CC)/[C@](C(OC\5)=O)(O)CC;0.8;13-fold resistance;;10uM;;;BCRP-expressing PC-6 cell ;uptake ;M. Yoshikawa, Int J Cancer (2004) 110, 921-7 ;;BCRP;1
2731;Human;SN-398;124623003;O=C\1N4\C(=C/C2=C/1COC(=O)[C@]2(O)CC)c3nc5c(c(c3C4)CC)cc(O)c(F)c5;O=C1C5=C(C(\[H])=C2N1CC3C(=C4C(=NC/2=3)C=C(C(=C4)O)F)CC)/[C@](C(OC\5)=O)(O)CC;1.0;213-fold resistance;;10uM;;;BCRP-expressing PC-6 cell ;uptake ;M. Yoshikawa, Int J Cancer (2004) 110, 921-7 ;;BCRP;1
2732;Human;SN-443;162472813;O=C\1N4\C(=C/C2=C/1COC(=O)[C@]2(O)CC)c3nc5c(c(c3C4)CC)cc(C)c(F)c5;O=C1C5=C(C(\[H])=C2N1CC3C(=C4C(=NC/2=3)C=C(C(=C4)C)F)CC)/[C@](C(OC\5)=O)(O)CC;0.0;1.8-fold resistance;;10uM;;;BCRP-expressing PC-6 cell ;uptake ;M. Yoshikawa, Int J Cancer (2004) 110, 921-7 ;;BCRP;0
2734;Human;Sotalol;3930209;O=S(=O)(Nc1ccc(cc1)C(O)CNC(C)C)C;O=S(=O)(NC1=CC=C(C=C1)C(O)CNC(C)C)C;0.05;(imputed as non-binder from inhibition data);0.0;10uM;100% at 50mkM;Mitoxantrone;Saos-2/wtABCG2 cells;ABCG2 (BCRP) Mitoxantrone accumulation (fold increase, at 50mkM);P.Matsson et al, J Pharmacol Exp Ther(2007), 323(1), 19-30;;BCRP;0
2736;Human;Sulfasalazine;599791;O=S(=O)(Nc1ccccn1)c3ccc(/N=N/c2cc(C(O)=O)c(O)cc2)cc3;O=S(=O)(NC1=NC=CC=C1)C2=CC=C(C=C2)/N=N/C3=CC=C(C(=C3)C(O)=O)O;1.0;Km=0.7mkM (pH=7.0) and Km=0.66mkM (pH=5.5);0.0;10uM;0.4-fold increase at 50mkM (108% at 50mkM);Mitoxantrone;"Saos-2/wtABCG2 cells; BCRP-expressing Sf9 vesicles";ABCG2 (BCRP) Mitoxantrone accumulation (fold increase, at 50mkM);"P.Matsson et al, J Pharmacol Exp Ther(2007), 323(1), 19-30; M.Jani et al, Biol Pharm Bull (2009), 32(30), 497-9";;BCRP;1
2739;Human;Tamoxifen;10540291;CCC(=C(c1ccccc1)c2ccc(OCCN(C)C)cc2)c3ccccc3;CCC(=C(C1=CC=CC=C1)C2=CC=C(C=C2)OCCN(C)C)C3=CC=CC=C3;1.0;;0.5;10uM;"1.02-fold increase at 3mkM (weak interaction [Sugimoto]); 3.8-fold increase at 50mkM (36% at 50mkM); - at 30mkM";"SN-38; Mitoxantrone; Topotecan";"membrane vesicle from BCRP-expressing Lactococcus lactis cell; Saos-2/wtABCG2 cells; K562/BCRP cell";"ATPase assay; ABCG2 (BCRP) Mitoxantrone accumulation (fold increase, at 50mkM)";"T. Janvilisri, J Biol Chem (2003) 278, 20645-51; Y. Sugimoto, Mol Cancer Ther (2003) 2, 105-12; PMID17346156; P.Matsson et al, J Pharmacol Exp Ther(2007), 323(1), 19-30";;BCRP;1
2764;Human;Taurocholate;145426;O=S(=O)(O)CCNC(=O)CC[C@@H](C)[C@H]4CC[C@H]3[C@H]2[C@@H]([C@@]1([C@@H](C[C@H](O)CC1)C[C@H]2O)C)C[C@H](O)[C@@]34C;O=S(=O)(O)CCNC(=O)CC[C@@H](C)[C@@H]1[C@@]2([C@H](C[C@H]3[C@H]([C@@H]2CC1)[C@@H](C[C@H]4[C@]3(CC[C@H](C4)O)C)O)O)C;0.0; - at 0.5mkM [Suzuki];0.9;10uM;"70% at 10mkM (75% at 30mkM); 107% at 150mkM; 100% at 50mkM";"Estrone 3-sulfate; Estrone 3-sulfate; Mitoxantrone";"membrane vesicle from BCRP-expressing K562 cell; P388/BCRP cell; Saos-2/wtABCG2 cells";"inhibition of E1S uptake; ABCG2 (BCRP) Mitoxantrone accumulation";"Y. Imai, Mol Pharmacol (2003) 64, 610-8; M. Suzuki, J Biol Chem (2003) 278, 22644-9; P.Matsson et al, Pharm Res(2009), 26(8), 1816-31";;BCRP;0
2766;Human;Taurolithocholate-3-sulfate;15324659;O=S(=O)(O)CCNC(=O)CC[C@H]([C@H]1CCC2[C@]1(C)CCC4C2CC[C@@H]3C[C@H](OS(=O)(=O)O)CC[C@@]34C)C;O=S(=O)(O)CCNC(=O)CC[C@H]([C@@H]1[C@@]2(C(CC1)C3C(CC2)[C@]4(CC[C@H](C[C@H]4CC3)OS(=O)(=O)O)C)C)C;0.0; - at 0.5mkM [Suzuki];0.5;10uM;IC50=37mkM (30% at 30mkM);Estrone 3-sulfate;"membrane vesicle from BCRP-expressing K562 cell; P388/BCRP cell";inhibition of E1S ;"Y. Imai, Mol Pharmacol (2003) 64, 610-8; M. Suzuki, J Biol Chem (2003) 278, 22644-9; M. Suzuki, J Biol Chem (2003) 278, 22644-9";;BCRP;0
2767;Human;Tectochrysin;520285;COc1cc(O)c2C(=O)C=C(Oc2c1)c3ccccc3;COC1=CC2OC(=CC(C=2C(=C1)O)=O)C3=CC=CC=C3;0.0; - [by ATPase];1.0;10uM;IC50=3mkM;Mitoxantrone;HEK293-transfected cells;drug resistance;"PMID17346156; A.Ahmed-Belkacem et al, Cancer Res (2005), 65(11), 4852-60";;BCRP;0
2768;Human;Teniposide;29767202;COc8cc(C5C1C(COC1=O)C(OC2OC3COC(OC3C(O)C2O)C4SC=CC=4)c6cc7OCOc7cc56)cc(OC)c8OC;COC1=C(C(=CC(=C1)C2C7C=C8OCOC8=CC=7C(C3C2C(OC3)=O)OC4C(C(C5OC(OCC5O4)C6=CC=CS6)O)O)OC)OC;1.0;;;10uM;;;BCRP-expressing MEF3.8 cell ;drug resistance ;J. D. Allen, Cancer Res (2003) 63, 1339-44 ;;BCRP;1
2771;Human;Testosterone;58220;O=C4\C=C2/[C@]([C@H]1CC[C@@]3([C@@H](O)CC[C@H]3[C@@H]1CC2)C)(C)CC4;O=C4C(/[H])=C3/[C@@]([C@@H]1[C@H]([C@@H]2CC[C@@H]([C@@]2(CC1)C)O)CC3)(C)CC4;1.0;;0.0;10uM;94% at 50mkM;Mitoxantrone;"membrane vesicle from BCRP-expressing Lactococcus lactis cell; Saos-2/wtABCG2 cells";"ATPase assay; ABCG2 (BCRP) Mitoxantrone accumulation";"T. Janvilisri, J Biol Chem (2003) 278, 20645-51; P.Matsson et al, Pharm Res(2009), 26(8), 1816-31";;BCRP;1
2773;Human;Tetrandrine;518343;O(c7c(OC)cc4c5c7Oc1cc2c(cc1OC)CCN(C)[C@H]2Cc6ccc(Oc3cc(ccc3OC)C[C@@H]5N(C)CC4)cc6)C;O(C1=C2C7=C(C=C1OC)CCN([C@H]7CC6=CC(OC5C=CC(C[C@@H]4N(CCC3C4=CC(O2)=C(C=3)OC)C)=CC=5)=C(C=C6)OC)C)C;0.1; - [by inference];0.0;10uM; - at 10mkM;Calcein-AM;;"drug resistance; SYN: NSC 77037";M.Susa et al, J Biomol Screen (2010) ASAP;;BCRP;0
2777;Human;Timolol;26839758;O[C@H](COc1nsnc1N2CCOCC2)CNC(C)(C)C;O[C@H](COC1C(=NSN=1)N2CCOCC2)CNC(C)(C)C;0.05;(imputed as non-binder from inhibition data);0.0;10uM;0.9-fold increase at 50mkM;Mitoxantrone;Saos-2/wtABCG2 cells;ABCG2 (BCRP) Mitoxantrone accumulation (fold increase, at 50mkM);P.Matsson et al, J Pharmacol Exp Ther(2007), 323(1), 19-30;;BCRP;0
2780;Human;Topotecan;123948878;Oc2ccc3nc4C5=CC1=C(COC(=O)C1(O)CC)C(=O)N5Cc4cc3c2CN(C)C;OC1C(=C2C=C3CN4C(C5=C(C=C4C3=NC2=CC=1)C(C(OC5)=O)(O)CC)=O)CN(C)C;1.0;" + ; Km=213mkM";;10uM;;;"Bcrp1-expressing LLC-PK1 cell; MDCKII-BCRP";transepithelial transport (basal to apical) ;"J. W. Jonker, J Natl Cancer Inst (2000) 92, 1651-6; PMID17346156; H.Li et al, Pharm Res(2008), 25(11), 2601-12";;BCRP;1
2782;;tRA01015;0;C1[C@]([C@@H](OC(=O)c5cc(OC)ccc5)C([C@@](CO2)(OC(C)=O)[C@H]2C[C@@H]3OC(=O)C=Cc6ccc(cc6)C(=O)c7ccccc7)[C@]3(C)C([C@@H]4OC(C)=O)=O)(O)C(C)(C)C4=C(C)[C@H]1OC(=O)C;C1[C@@H](C(=C5C([C@]1([C@@H](OC(=O)C2=CC=CC(=C2)OC)C4[C@]3(CO[C@@H]3C[C@@H]([C@]4(C)C([C@@H]5OC(C)=O)=O)OC(=O)C=CC6=CC=C(C=C6)C(=O)C7=CC=CC=C7)OC(C)=O)O)(C)C)C)OC(=O)C;0.0; - [Brooks TA];1.0;10uM; + at 10mkM;Mitoxantrone;8226/MR20 cells;efflux of mitoxantrone ;T.Brooks et al, Molecular Cancer Therapeutics (2003) 1195-1205;;BCRP;0
2783;Human;tRA01069;0;C1[C@]([C@@H](OC(=O)c5ccccc5)C([C@@](CO2)(OC(C)=O)[C@H]2C[C@@H]3OC(=O)C=Cc6ccc(cc6)OC(=O)c7ccc(OC)c8c7cccc8)[C@]3(C)C([C@@H]4OC(C)=O)=O)(O)C(C)(C)C4=C(C)[C@H]1OC(=O)C;C1[C@@H](C(=C5C([C@]1([C@@H](OC(=O)C2=CC=CC=C2)C4[C@]3(CO[C@@H]3C[C@@H]([C@]4(C)C([C@@H]5OC(C)=O)=O)OC(=O)C=CC6=CC=C(C=C6)OC(=O)C7=C8C(=C(C=C7)OC)C=CC=C8)OC(C)=O)O)(C)C)C)OC(=O)C;0.0; - [Brooks TA];0.0;10uM; - at 10mkM;Mitoxantrone;8226/MR20 cells;efflux of mitoxantrone ;T.Brooks et al, Molecular Cancer Therapeutics (2003) 1195-1205;;BCRP;0
2784;Human;tRA9-1a;0;C1[C@]([C@@H](OC(=O)c5ccccc5)C([C@@](CO2)(OC(C)=O)[C@H]2C[C@@H]3OC(=O)C=Cc6ccc(cc6)C(=O)c7ccc(N(CC)CC)cc7)[C@]3(C)C([C@@H]4OC(C)=O)=O)(O)C(C)(C)C4=C(C)[C@H]1OC(=O)C;C1[C@@H](C(=C5C([C@]1([C@@H](OC(=O)C2=CC=CC=C2)C4[C@]3(CO[C@@H]3C[C@@H]([C@]4(C)C([C@@H]5OC(C)=O)=O)OC(=O)C=CC6=CC=C(C=C6)C(=O)C7=CC=C(C=C7)N(CC)CC)OC(C)=O)O)(C)C)C)OC(=O)C;0.0; - [Brooks TA];1.0;10uM; + at 10mkM;Mitoxantrone;8226/MR20 cells;efflux of 3mkM mitoxantrone ;I.Ojima et al, J Med Chem (2003) 48(6), 2218-28;;BCRP;0
2785;Human;tRA9-2a;0;C1[C@]([C@@H](OC(=O)c5ccccc5)C([C@@](CO2)(OC(C)=O)[C@H]2C[C@@H]3OC(=O)C=Cc6ccc(cc6)C(=O)c7ccc(OCC)cc7)[C@]3(C)C([C@@H]4OC(C)=O)=O)(O)C(C)(C)C4=C(C)[C@H]1OC(=O)C;C1[C@@H](C(=C5C([C@]1([C@@H](OC(=O)C2=CC=CC=C2)C4[C@]3(CO[C@@H]3C[C@@H]([C@]4(C)C([C@@H]5OC(C)=O)=O)OC(=O)C=CC6=CC=C(C=C6)C(=O)C7=CC=C(C=C7)OCC)OC(C)=O)O)(C)C)C)OC(=O)C;0.0; - [Brooks TA];1.0;10uM; + at 10mkM;Mitoxantrone;8226/MR20 cells;efflux of 3mkM mitoxantrone ;I.Ojima et al, J Med Chem (2003) 48(6), 2218-28;;BCRP;0
2786;Human;tRA95069;0;C1[C@]([C@@H](OC(=O)c5ccccc5)C([C@@](CO2)(OC(C)=O)[C@H]2C[C@@H]3OC(=O)C=Cc6cc7ccccc7cc6)[C@]3(C)C([C@@H]4OC(C)=O)=O)(O)C(C)(C)C4=C(C)[C@H]1O;C1[C@@H](C(=C5C([C@]1([C@@H](OC(=O)C2=CC=CC=C2)C4[C@]3(CO[C@@H]3C[C@@H]([C@]4(C)C([C@@H]5OC(C)=O)=O)OC(=O)C=CC6=CC=C7C=CC=CC7=C6)OC(C)=O)O)(C)C)C)O;0.0; - [Brooks TA];1.0;10uM; + at 10mkM;Mitoxantrone;8226/MR20 cells;efflux of mitoxantrone ;T.Brooks et al, Molecular Cancer Therapeutics (2003) 1195-1205;;BCRP;0
2787;Human;tRA96023;204580007;C1[C@]([C@@H](OC(=O)c5ccccc5)C([C@@](CO2)(OC(C)=O)[C@H]2C[C@@H]3OC(=O)C=Cc6ccc(cc6)C(=O)c7ccccc7)[C@]3(C)C([C@@H]4OC(C)=O)=O)(O)C(C)(C)C4=C(C)[C@H]1OC(=O)C;C1[C@@H](C(=C5C([C@]1([C@@H](OC(=O)C2=CC=CC=C2)C4[C@]3(CO[C@@H]3C[C@@H]([C@]4(C)C([C@@H]5OC(C)=O)=O)OC(=O)C=CC6=CC=C(C=C6)C(=O)C7=CC=CC=C7)OC(C)=O)O)(C)C)C)OC(=O)C;0.0; - [Brooks TA];1.0;10uM; + at 10mkM;Mitoxantrone;8226/MR20 cells;efflux of 3mkM mitoxantrone ;T.Brooks et al, Molecular Cancer Therapeutics (2003) 1195-1205;;BCRP;0
2788;Human;tRA97013;0;O=C6OC1[C@]([C@@H](OC(=O)c5ccccc5)C([C@@](CO2)(OC(C)=O)[C@H]2C[C@@H]3OC(=O)C=Cc8ccc(cc8)C(=O)c7ccccc7)[C@]3(C)C([C@@H]4OC(C)=O)=O)(O6)C(C)(C)C4=C(C)[C@H]1OC(=O)C;O=C1O[C@]23C(O1)[C@@H](C(=C(C2(C)C)[C@H](C([C@@]6(C([C@@H]3OC(=O)C4=CC=CC=C4)[C@]5(CO[C@@H]5C[C@@H]6OC(=O)C=CC7=CC=C(C=C7)C(=O)C8=CC=CC=C8)OC(C)=O)C)=O)OC(C)=O)C)OC(=O)C;0.0; - [Brooks TA];1.0;10uM; + at 10mkM;Mitoxantrone;8226/MR20 cells;efflux of mitoxantrone ;T.Brooks et al, Molecular Cancer Therapeutics (2003) 1195-1205;;BCRP;0
2789;Human;tRA97045;0;C1[C@]([C@@H](OC(=O)c5ccccc5)C([C@@](CO2)(OC(C)=O)[C@H]2C[C@@H]3OC(=O)C=Cc6ccc(cc6)C(=O)c7ccc(F)cc7)[C@]3(C)C([C@@H]4OC(C)=O)=O)(O)C(C)(C)C4=C(C)[C@H]1OC(=O)C;C1[C@@H](C(=C5C([C@]1([C@@H](OC(=O)C2=CC=CC=C2)C4[C@]3(CO[C@@H]3C[C@@H]([C@]4(C)C([C@@H]5OC(C)=O)=O)OC(=O)C=CC6=CC=C(C=C6)C(=O)C7=CC=C(C=C7)F)OC(C)=O)O)(C)C)C)OC(=O)C;0.0; - [Brooks TA];0.0;10uM; - at 10mkM;Mitoxantrone;8226/MR20 cells;efflux of mitoxantrone ;T.Brooks et al, Molecular Cancer Therapeutics (2003) 1195-1205;;BCRP;0
2790;Human;tRA98005;0;C1[C@]([C@@H](OC(=O)c5ccccc5)C([C@@](CO2)(OC(C)=O)[C@H]2C[C@@H]3OC(=O)C=Cc6ccc(c8c6)C(=O)c7c8cccc7)[C@]3(C)C([C@@H]4OC(C)=O)=O)(O)C(C)(C)C4=C(C)[C@H]1OC(=O)C;C1[C@@H](C(=C5C([C@]1([C@@H](OC(=O)C2=CC=CC=C2)C4[C@]3(CO[C@@H]3C[C@@H]([C@]4(C)C([C@@H]5OC(C)=O)=O)OC(=O)C=CC6=CC8=C(C=C6)C(=O)C7=CC=CC=C78)OC(C)=O)O)(C)C)C)OC(=O)C;0.0; - [Brooks TA];1.0;10uM; + at 10mkM;Mitoxantrone;8226/MR20 cells;efflux of mitoxantrone ;T.Brooks et al, Molecular Cancer Therapeutics (2003) 1195-1205;;BCRP;0
2791;Human;tRA98006;0;C1[C@]([C@@H](OC(=O)c5ccccc5)C([C@@](CO2)(OC(C)=O)[C@H]2C[C@@H]3OC(=O)C=Cc6ccc(cc6)C(=O)c7ccc(N(C)C)cc7)[C@]3(C)C([C@@H]4OC(C)=O)=O)(O)C(C)(C)C4=C(C)[C@H]1OC(=O)C;C1[C@@H](C(=C5C([C@]1([C@@H](OC(=O)C2=CC=CC=C2)C4[C@]3(CO[C@@H]3C[C@@H]([C@]4(C)C([C@@H]5OC(C)=O)=O)OC(=O)C=CC6=CC=C(C=C6)C(=O)C7=CC=C(C=C7)N(C)C)OC(C)=O)O)(C)C)C)OC(=O)C;0.0; - [Brooks TA];1.0;10uM; + at 10mkM (2-fold increase at 0.1mkM);Mitoxantrone;8226/MR20 cells;efflux of mitoxantrone ;"T.Brooks et al, Molecular Cancer Therapeutics (2003) 1195-1205; I.Ojima et al, J Med Chem (2003) 48(6), 2218-28";;BCRP;0
2792;Human;tRA98007;0;C1[C@]([C@@H](OC(=O)c5ccccc5)C([C@@](CO2)(OC(C)=O)[C@H]2C[C@@H]3OC(=O)C=Cc6ccc(cc6)C(=O)c7ccc(OC)cc7)[C@]3(C)C([C@@H]4OC(C)=O)=O)(O)C(C)(C)C4=C(C)[C@H]1OC(=O)C;C1[C@@H](C(=C5C([C@]1([C@@H](OC(=O)C2=CC=CC=C2)C4[C@]3(CO[C@@H]3C[C@@H]([C@]4(C)C([C@@H]5OC(C)=O)=O)OC(=O)C=CC6=CC=C(C=C6)C(=O)C7=CC=C(C=C7)OC)OC(C)=O)O)(C)C)C)OC(=O)C;0.0; - [Brooks TA];1.0;10uM; + at 10mkM (2.8-fold increase at 0.1mkM);Mitoxantrone;8226/MR20 cells;efflux of mitoxantrone ;"T.Brooks et al, Molecular Cancer Therapeutics (2003) 1195-1205; I.Ojima et al, J Med Chem (2003) 48(6), 2218-28";;BCRP;0
2793;Human;tRA98009;0;C1[C@]([C@@H](OC(=O)c5ccccc5)C([C@@](CO2)(OC(C)=O)[C@H]2C[C@@H]3OC(=O)C=Cc6ccc(cc6)C(=O)c7ccc(C(C)C)cc7)[C@]3(C)C([C@@H]4OC(C)=O)=O)(O)C(C)(C)C4=C(C)[C@H]1OC(=O)C;C1[C@@H](C(=C5C([C@]1([C@@H](OC(=O)C2=CC=CC=C2)C4[C@]3(CO[C@@H]3C[C@@H]([C@]4(C)C([C@@H]5OC(C)=O)=O)OC(=O)C=CC6=CC=C(C=C6)C(=O)C7=CC=C(C=C7)C(C)C)OC(C)=O)O)(C)C)C)OC(=O)C;0.0; - [Brooks TA];1.0;10uM; + at 10mkM;Mitoxantrone;8226/MR20 cells;efflux of mitoxantrone ;T.Brooks et al, Molecular Cancer Therapeutics (2003) 1195-1205;;BCRP;0
2794;Human;tRA98010;0;C1[C@]([C@@H](OC(=O)c5ccccc5)C([C@@](CO2)(OC(C)=O)[C@H]2C[C@@H]3OC(=O)C=Cc6ccc(cc6)C(=O)c7ccc(C)cc7)[C@]3(C)C([C@@H]4OC(C)=O)=O)(O)C(C)(C)C4=C(C)[C@H]1OC(=O)C;C1[C@@H](C(=C5C([C@]1([C@@H](OC(=O)C2=CC=CC=C2)C4[C@]3(CO[C@@H]3C[C@@H]([C@]4(C)C([C@@H]5OC(C)=O)=O)OC(=O)C=CC6=CC=C(C=C6)C(=O)C7=CC=C(C=C7)C)OC(C)=O)O)(C)C)C)OC(=O)C;0.0; - [Brooks TA];0.0;10uM; - at 10mkM;Mitoxantrone;8226/MR20 cells;efflux of mitoxantrone ;T.Brooks et al, Molecular Cancer Therapeutics (2003) 1195-1205;;BCRP;0
